{
  "taskId": "11111111-1111-4111-8111-111111111111",
  "title": "核查离职人员相关流程配置",
  "originalQuestion": "请核查指定范围内的流程配置并输出可追溯结论。",
  "status": "DRAFT",
  "rowVersion": 0,
  "createdAt": "2026-09-26T09:00:00Z",
  "premises": [
    {
      "type": "PERSONNEL_EVENT",
      "subjectKey": "synthetic-user-001",
      "statement": "合成人员已离职",
      "sourceDescription": "合成任务前提"
    }
  ]
}
